																								
Required. If you change a name, you'll need to change any references to it on the Works page or here in relationships.	Optional.  Comma Separated.	Required	Optional.  Comma Separated.	Required.   Use "c." for circa	Required	Required.  Use "c." for circa	Required	Required	Desired	Desired.	Desired	Desired	Desired	Desired	Nice to Have	Nice to Have	Nice to Have	Nice to Have	Nice to Have	Nice to Have	Nice to Have	Nice to Have		You can add other relationships, if they help
Primary English Name	Secondary English Names	Primary Hebrew Name	Secondary Hebrew Names	Birth Year 	Birth Place	Death Year	Death Place	Halachic Era	English Biography	Hebrew Biography	English Wikipedia Link	Hebrew Wikipedia Link	Jewish Encyclopedia Link	Brill Online Reference Words (Encyclopedia of Jewish in the Islamic, Encyclopedia of the Hebrew Language, Encyclopedia of Judaism)	Child of	Grandchild of	Son/Daughter in Law of	Student of	From the school of	Corresponded With	Opposed	Cousin	Sex	
anonymous	ignore this line																							
Saadia Gaon	Rasag, Sa'adia ben Yosef Al-Fayyumi	סעדיה גאון	רס"ג, סעדיה בן יוסף אלפיומי	882	Dilas, Egypt	942	Baghdad, Iraq	Gaonim	Saadia Gaon was a philosopher, halachist, biblical commentator, polemicist, grammarian and pre-eminent Jewish leader of Mesopotamian Jewry. His best-known work, Emunot vDeot, was the first systematic work of Jewish philosophy. His ground-breaking work in Hebrew grammar was part of his polemic against Karaism. He was the first Torah sage to write extensively in Judeo-Arabic, In 928 he was appointed Gaon (preeminant spiritual and temporal leader) of the academy of Sura, and subsequently, his influence spread throughout the Jewish world. 		https://en.wikipedia.org/wiki/Saadia_Gaon	https://he.wikipedia.org/wiki/%D7%A1%D7%A2%D7%93%D7%99%D7%94_%D7%92%D7%90%D7%95%D7%9F	http://www.jewishencyclopedia.com/articles/12950-saadia	http://referenceworks.brillonline.com/entries/encyclopedia-of-jews-in-the-islamic-world/saadya-gaon-COM_0018750						Isaac Israeli of Qayrawan			M	
Rashi	Shlomo Yitzchaki, Salomon Isaacides	רש״י	רבי שלמה יצחקי	1040	Troyes, France	1105	Troyes, France	Rishonim	Rabbi Shelomo ben Yitzhak, best known by the acronym Rashi, authored the most authoritative commentaries on the Tanakh and Talmud. He was also a halakhist who authored responsa. Rashi is known as the father of all commentators. There are no extant manuscripts of his works copied prior to his death. Rashi was an early and very influential medieval Torah and Talmud commentator who lived in France. Rashi's commentary on the Bible is often considered an indispensable tool for Torah study. He described his aim as clarifying the "peshat" or "plain-sense" meaning of each verse.        	רבי שלמה בן יצחק, הידוע על פי ראשי התיבות רש"י, חיבר את הפירושים הסמכותיים ביותר לתנ"ך ולתלמוד. רש"י עסק גם בפסקי הלכה וחיבר שו"תים. הוא ידוע כ"אבי כל הפרשנים". לא נמצאים בידינו העתקים של כתבי יד שלו מלפני מותו. רש"י חי בצרפת והיה פרשן תנ"ך ותלמוד קדום ובעל השפעה רבה. פירושו של רש"י על התנ"ך נחשב לעתים קרובות כלי הכרחי ללימוד תורה. המטרה שלו הייתה הבהרת הפשט, המשמעות הפשוטה של כל פסוק.	https://en.wikipedia.org/wiki/Rashi	https://he.wikipedia.org/wiki/רש%22י	http://www.jewishencyclopedia.com/articles/12585-rashi-solomon-bar-isaac	http://referenceworks.brillonline.com/entries/encyclopaedia-of-judaism/rashi-COM_0157									M	
Meir ben Shmuel	Ra"M	מאיר בן שמואל	ר"ם	c. 1060	Ramerupt, France	c. 1135		Rishonim	Rabbi Meir ben Shmuel was a French rabbi and tosafist. He was one of the founders of the Tosafost school and approach to Talmudic commentary. He was a son-in-law of Rashi, and three of his sons, Rashbam, Rivam and Rabbenu Tam, were amongst the greatest of talmudists and tosafists, and leaders of their generation. 		https://en.wikipedia.org/wiki/Meir_ben_Samuel	https://he.wikipedia.org/wiki/%D7%9E%D7%90%D7%99%D7%A8_%D7%91%D7%9F_%D7%A9%D7%9E%D7%95%D7%90%D7%9C	http://www.jewishencyclopedia.com/articles/14457-tosafot#anchor46				Rashi	Riva	Tosafot				M	Four sons, Rabbenu Tam, Rashbam, Isaac ben Meir, Solomon ben Meir
Rambam	Moshe ben Maimon, Maimonides, Moses Maimonides	רמב"ם	משה בן מימון	1137/38	Cordoba, Spain	1204	Fustat, Egypt	Rishonim	Rambam (Rabbi Moshe ben Maimon), was perhaps the greatest intellectual and spiritual figure of post-Talmudic Judaism. He wrote indispensible works of philosophy, halachah, commentary, responsa. Born in Spain, his family fled while he was still a youth. After an extended period in Morocco, he settled in Egypt, where he became Nagid (leader) of the Jewish community. All his works werer foundational in their field. His commentary to the Mishnah was the first comprehensive commentary on the entire Mishnah. His great work of philosophy, Moreh Nevuchim, spawned an entire discipline and had incalculable influence upon enthusiastic promoters and vehement opponents alike. His code of law, Mishneh Torah, is the first and unsurpassed comprehesive code, covering all areas of Jewish law and practice. His medical writings - Rambam served as court physician to the Muslim leader Saladin - had a lasting impact. All of his works were written in Judeo-Arabic except for Mishneh Torah, which was written in a Hebrew of exquisite felicity. The precision of his expression is legendary. His descendents served as Negidim of Egypt for another four generations.		https://en.wikipedia.org/wiki/Maimonides	https://he.wikipedia.org/wiki/רמב%22ם	http://www.jewishencyclopedia.com/articles/11124-moses-ben-maimon	http://referenceworks.brillonline.com/entries/encyclopedia-of-jews-in-the-islamic-world/m-maimonides-moses-rambam-mallah-moses-aaron-SIM_INDEXM2?s.num=0&s.f.s2_parent=s.f.book.encyclopedia-of-jews-in-the-islamic-world&s.q=Rambam	Maimon			Maimon					M	Son Abraham ben Moses Maimon
Ramban	Nachmanides, Moses ben Nahman Girondi	רמב״ן	רבי משה בן נחמן	1194	Girona, Catalonia, Spain	1270	Akko	Rishonim	Rabbi Moshe ben Nachman authored commentaries on the Torah and the Talmud. He was a halakhist who wrote responsa and stand alone works on Halakhic issues as well as works on mysticism, science and philosophy.  Ramban was a Spanish scholar of Bible, Talmud, and Jewish Law.  Ramban's commentary on the Torah often critiques earlier commentaries, and incoporates Kabbalistic teachings.        	רבי משה בן נחמן חיבר פירושים על התורה והתלמוד. הוא היה איש הלכה שכתב שו"תים וחיבורים עצמאיים בנושאים הלכתיים, כמו גם חיבורים על מיסטיקה, מדע ופילוסופיה. הרמב"ן (שנפטר בשנת 1270) היה תלמיד חכם ספרדי שעסק בתנ"ך, תלמוד והלכה. פירושו של הרמב"ן על התורה לעתים קרובות מבקר פירושים קודמים, ומשלב את תורת קבלה.	https://en.wikipedia.org/wiki/Nahmanides	https://he.wikipedia.org/wiki/רמב%22ן	http://www.jewishencyclopedia.com/articles/11129-moses-ben-nahman-gerondi	http://referenceworks.brillonline.com/search?s.num=0&s.rows=20&s.mode=DEFAULT&s.f.s2_parent=encyclopedia-of-hebrew-language-and-linguistics&s.au=&s.excl=&s.sub=&s.start=0&s.q=nachmanides&s.head=				Azriel of Gerona				Rabbeinu Yonah	M	Great Grand Father of Gershonides
Rashbam	Shemuel ben Meir	רשב״ם	שמואל בן מאיר	c.1085		 c. 1174		Rishonim	Rabbi Sh'muel ben Meir was the grandson of Rashi. He authored a commentary on the Torah that clung strictly to the concept of p'shat sometimes at the expense of received rabbinic traditions. He also wrote a commentary on portions of the Talmud. Rashbam was a French Torah and Talmud commentator. Rashbam's commentary on the Torah provides a detailed "peshat" or "plain-sense" explanation of verse in the Bible. 	רבי שמואל בן מאיר היה נכדו של רש"י. הוא חיבר פירוש על התורה שדבק בקפדנות במושג ה"פשט", לפעמים על חשבון מסורות רבניות מקובלות. הוא כתב גם פירוש על חלקים של התלמוד. רשב"ם (שנפטר בסביבות 1174) היה פרשן תורה ותלמוד צרפתי. פירושו של רשב"ם על התורה מספק "פשט" מפורט של פסוק בתנ"ך.	https://en.wikipedia.org/wiki/Rashbam	https://en.wikipedia.org/wiki/Rashbam	http://www.jewishencyclopedia.com/articles/13128-samuel-b-meir-rashbam		Meir ben Shmuel	Rashi		Meir ben Shmuel	Tosafot				M	Had several students cf. Norman Golb
Rabbeinu Yonah of Gerondi	Yonah Gerondi, Yonah ben Abraham Gerondi	רבינו יונה	יונה גירונדי	1200	Girona, Catalonia, Spain	c. 1264		Rishonim	Rabbeinu Yonah of Gerondi was a Spanish rabbi, talmudist and ethicist. His best-known work is Sha'arei Teshuva, a comprehensive work on repentence and a much-studied and quoted work over the generations He also wrote chiddushim on a number of tractates, quoted by contemporaries and later authors. He was one of the most prominent of the opponents the Rambam's philosophical works, signing a ban on their study. When the sustained attacks on the Rambam's works culminated in a public burning of wagon-loads of Talmud by Christian authorities, Rabbeinu Yonah publicly admitted his error in involved outside players, and gave Rambam a prominent and revered place in his teaching. It is surmised that this turn of events motivated Rabbeinu Yonah to write Sha'arei Teshuva.		https://en.wikipedia.org/wiki/Yonah_Gerondi	https://he.wikipedia.org/wiki/%D7%99%D7%95%D7%A0%D7%94_%D7%92%D7%99%D7%A8%D7%95%D7%A0%D7%93%D7%99	http://www.jewishencyclopedia.com/articles/11129-moses-ben-nahman-gerondi									Ramban	M	Great Grand Father of Gershonides
Ibn Ezra	Abraham Ben Meir Ibn Ezra	אבן עזרא	אברהם אבן עזרא, ראב"ע	1089-1092	Tudela, Spain	1164-1167	Shropshire, England	Rishonim	Avraham ben Meir was born in Spain but travelled extensively throughout his life. A gifted polymath he wrote an extensive commentary on the torah as well as on grammar, philosophy, astronomy, medicine, and mathematics. His poetry is still read and sung as part of the regular liturgy. Ibn Ezra was a Spanish Torah commentator, who also wrote works on a number of other subjects, including Hebrew grammar and philosophy.  Ibn Ezra's Bible commentary often focuses on grammatical explanations and on the literal meaning of verses.       	אברהם בן מאיר נולד בספרד אבל נסע רבות במהלך חייו. איש אשכולות מוכשר, אבן עזרא כתב פרשנות נרחבת על התורה, כמו גם על דקדוק, פילוסופיה, אסטרונומיה, רפואה ומתמטיקה. השירה שלו עדיין נקראת ומושרת כחלק מן התפילה הקבועה. אבן עזרא (שנפטר בסביבות 1167) היה פרשן תורה ספרדי, שכתב גם חיבורים על כמה נושאים אחרים, לרבות דקדוק עברית ופילוסופיה. פרשנות המקרא של אבן עזרא לעתים קרובות מתמקדת בהסברים דקדוקיים ובמשמעות המילולית של פסוקים.	https://en.wikipedia.org/wiki/Abraham_ibn_Ezra	https://he.wikipedia.org/wiki/%D7%90%D7%91%D7%A8%D7%94%D7%9D_%D7%90%D7%91%D7%9F_%D7%A2%D7%96%D7%A8%D7%90	http://www.jewishencyclopedia.com/articles/435-abraham-ibn-ezra	http://referenceworks.brillonline.com/entries/encyclopedia-of-jews-in-the-islamic-world/ibn-ezra-abraham-abu-ishaq-COM_0010510									M	Several people have the same name as him including the famous Moses Ibn Ezra, but it is disputed if they were related in more modern scholarship. Further research is necesary. He son was Isaac ibn Ezra.
Shlomo Ephraim ben Aaron Luntschitz	Kli Yakar 	שלמה אפרים מלונטשיץ	כלי יקר	1550	Luntschitz, Poland	1619		Achronim	Shlomo Ephraim Luntschitz was the Chief Rabbi of Prague who wrote a commentary on the Torah, Keli Yakar (a precious vessel) as well as a number of other collections of homilies sermons. Rabbi Luntschitz was a Polish rabbi and orator who is best known for his Torah commentary, Kli Yakar. Keli Yakar is a commentary on the Torah written in a homiletical style.        	רבי שלמה אפרים מלונטשיץ היה הרב הראשי של פראג והוא כתב את הפירוש "כלי יקר" על התורה, וכן כמה אוספים אחרים של דרשות. הרבי מלונטשיץ (שנפטר בשנת 1619) היה רב פולני ונואם, והוא ידוע בעיקר בזכות פרשנותו לתורה. ה"כלי יקר" הוא פירוש על התורה שכתוב בסגנון של מדרש.	https://en.wikipedia.org/wiki/Shlomo_Ephraim_Luntschitz	https://he.wikipedia.org/wiki/%D7%A9%D7%9C%D7%9E%D7%94_%D7%90%D7%A4%D7%A8%D7%99%D7%9D_%D7%9E%D7%9C%D7%95%D7%A0%D7%98%D7%A9%D7%99%D7%A5	http://www.jewishencyclopedia.com/articles/10188-luntschitz-solomon-ephraim	http://referenceworks.brillonline.com/search				Maharshal	Poland				M	Mother was Rabbanit Miriam Shapira-Luria
Sforno	Seforno, Obadiah ben Jacob Sforno	ספורנו	עובדיה ספורנו	c. 1470	Cesena	1550	Bologna Spain	Rishonim	Rabbi Ovadia ben Yaakov Sforno wrote a commentary on the Torah that sticks to the pshat school. He also wrote works on philosophy and commentaries on a number of books of Tanakh. Sforno is also quoted in responsa of contemporary authorities who consulted him on issues of halakha. Rabbi Ovadiah ben Ya'akov Seforno (d. 1550) was an Italian exegete, philosopher, and physician. Seforno's Torah commentary focuses on the literal meaning of the text, avoids kabbalistic explanations, and sometimes incorporates his knowledge of medicine to help explain verses.        	רבי עובדיה בן יעקב ספורנו כתב פירוש על התורה שדבק בדוקטורינת ה"פשט". הוא כתב גם חיבורים בפילוסופיה ופירושים על כמה מספרי התנ"ך. ספורנו מצוטט אף בשו"תים של חכמים בני זמננו שנעזרו בו בענייני הלכה. רבי עובדיה בן יעקב ספורנו (שנפטר ב-1550) חי באיטליה ופעל כדרשן, פילוסוף ורופא. פירוש ספורנו לתורה מתמקד במשמעות המילולית של הכתוב, נמנע מהסברים מתורת הקבלה, ולעתים אף מכיל ידע רפואי כדי להסביר פסוקים מסוימים.	https://en.wikipedia.org/wiki/Obadiah_ben_Jacob_Sforno	https://he.wikipedia.org/wiki/%D7%A2%D7%95%D7%91%D7%93%D7%99%D7%94_%D7%A1%D7%A4%D7%95%D7%A8%D7%A0%D7%95	http://www.jewishencyclopedia.com/articles/11646-obadiah-ben-jacob-sforno	http://referenceworks.brillonline.com/search									M	
Rashba	HaRashba, Shlmo ben Adret	רשב"א	שלמה בן אדרת	1235	Barcelona, Spain	1310		Rishonim	Rabbi Shlomo ben Avraham ibn Adret (Rashba)  was a Spanish rabbi, talmudist, halachist and community leader in 14th centurry. He lived his entire life in Barcelona. He is considered the most outstanding student of the Ramban, and continued his approach in Talmudic exposition. His yeshiva drew exceptional students from throughout the Jewish world, including quite a number from Germany. He functioned as chief rabbi of Spain and wrote over 1000 responsa to individuals and communities throughout the Jewish world. He was involved in opposition to the Rambam's philosophical writings and prohibited study of philosophy under the age of 25. He also defended Judaism Christian and Moslem polemicists, and vigorously opposed the activity of R. Avraham Abulafia. He responded vigorously in his own defense to the often strident comments of R. Aharon Halevy on his work, Torat HaBayit.		https://en.wikipedia.org/wiki/Shlomo_ben_Aderet	https://he.wikipedia.org/wiki/%D7%A8%D7%A9%D7%91%22%D7%90	http://www.jewishencyclopedia.com/search?utf8=%E2%9C%93&keywords=solomon+ben+adret&commit=search	http://referenceworks.brillonline.com/search				Ramban, Rabbeinu Yonah of Gerondi					M	
Rivan	Yehudah ben Natan	ריב"ן	רבי יהודה בן נתן	c. 1080		c. 1140		Rishonim	Rabbi Yehudah ben Natan (Rivan) was a French rabbi, talmudist and early tosafist. He was a son-in-law of Rashi and in certain senses extended his work. He is quoted in many places in Tosafot.		https://en.wikipedia.org/wiki/Judah_ben_Nathan	https://he.wikipedia.org/wiki/%D7%99%D7%94%D7%95%D7%93%D7%94_%D7%91%D7%9F_%D7%A0%D7%AA%D7%9F	http://www.jewishencyclopedia.com/articles/14457-tosafot#anchor43				Rashi						M	
Ra'avan	Eliezer ben Natan	ראב"ן	רבי אליער בן נתן	1090		1170		Rishonim	Rabbi Eliezer ben Natan (Ra'avan) was a German rabbi, halakhist and commentator. His contemporaries and successors refer him as an authoritative transmitter and decisor of Jewish tradition and practice. Among his decendants and relatives were some of the great rabbinic figures of the next generations. He was one of the first Ashkenazic scholars to quote extensively from the Talmudic commentary of Rabbeynu Chananel. He was also the first German scholar to pen commentaries on piyyut. 		https://en.wikipedia.org/wiki/Eliezer_ben_Nathan	https://he.wikipedia.org/wiki/%D7%90%D7%9C%D7%99%D7%A2%D7%96%D7%A8_%D7%91%D7%9F_%D7%A0%D7%AA%D7%9F	http://www.jewishencyclopedia.com/articles/14457-tosafot#anchor43						Tosafot				M	
Ra'avyah	Eliezer ben Yoel Ha-Levi	ראבי"ה	רבי אליעזר בן יואל הלוי	1140		1225		Rishonim	Rabbi Eliezer ben Yoel Halevi (Ra'avyah) was a German rabbi, halachist and talmudist. Wandering between communities in Germany and France, he refused to serve in a formal rabbinic until poverty compelled him to accept a rabbinic position in Cologne, where he became famous.  His halachic works were considered authoritative and indispensiblle to his and subsequent generations, His brother's martyrdom caused him to grieve so intensely that his vision was subsequently impaired, and he dictated his later works to students. He was also active as as tosafist.		https://en.wikipedia.org/wiki/Eliezer_ben_Joel_HaLevi	https://he.wikipedia.org/wiki/%D7%90%D7%9C%D7%99%D7%A2%D7%96%D7%A8_%D7%91%D7%9F_%D7%99%D7%95%D7%90%D7%9C	http://www.jewishencyclopedia.com/articles/14457-tosafot#anchor43			Ravan			Tosafot	Natan ben Yehiel			M	
Rabbenu Tam	Yaakov ben Meir	רבנו תם	יעקב בן מאיר	1100		1171		Rishonim	Rabbi Yaakov ben Meir (Rabbenu Tam was a French rabbi, halakhic authority, liturgical poet and the greatest of the Tosafists. His renown extended well beyond France and Germany to Spain and beyond. His dispute with his grandfather, Rashi, regarding the order of the passages contained in the head-worn tefillin continues to impact daily Jewish practice to this day. He narrowly escaped death at the hands of Crusaders. He befriended Ibn Ezra during the latter's stay in France, and they maintained a subsequent correspondence.		https://en.wikipedia.org/wiki/Rabbeinu_Tam	https://he.wikipedia.org/wiki/%D7%A8%D7%91%D7%A0%D7%95_%D7%AA%D7%9D	http://www.jewishencyclopedia.com/articles/8436-jacob-ben-meir-tam		Meir ben Shmuel		Rashi		Tosafot				M	
Ran	Nissim of Gerona, Nissim ben Reuven	ר"ן	ניסים בן ראובן	1320	Barcelona, Spain	1376		Rishonim	Rabbi Nissim ben Reuven (Ran) was a Spanish rabbi, talmudist and philosopher and the pre-eminent Spanish halakhic authority of his generation. His commentaries to the Talmud and Hilchot  HaRif are main elements of yeshiva curriculum to this day. He establish his yeshiva and Beit Din in Barcelona. Like his predecessor, Rashba, Ran's renown extended to Jewish communities well beyond Spain, who address their questions to him and sought his guidance. He was not inclined toward the Kabbalah.		https://en.wikipedia.org/wiki/Nissim_of_Gerona	https://he.wikipedia.org/wiki/%D7%A8%22%D7%9F	http://www.jewishencyclopedia.com/articles/12560-ran										M	
Ra'ah	Aharon Ha-levi	רא"ה	אהרן הלוי	1235	Girona, Spain	1290		Rishonim	Rabbi Aharon HaLevi (Ra'ah) was a Spanish rabbi, talmudist, halakhist and critic of Rashba's Torat HaBayit.  Ascription to him of authorship of Sefer HaChinukh has been undermined and, of late, refuted. 		https://en.wikipedia.org/wiki/Aharon_HaLevi	https://he.wikipedia.org/wiki/%D7%A8%D7%90%22%D7%94	http://www.jewishencyclopedia.com/articles/63-aaron-ha-levi-of-barcelona					Ramban, Joseph ha-Levi		Rashba			M	
Ritva	Yom Tov ben Avraham Isbilli	ריטב"א	יום טוב בן אברהם  אשבילי	1250	Seville, Spain	1330		Rishonim	Rabbi Yom Tov ben Avraham Isbilli (Ritva) was a Spanish rabbi and talmudist. His commentaries to many tractates of the Talmud are a mainstay of yeshiva study to this day. As his name indicates, he was born in Seville in southern Spain shortly after its reconquest by the Christians from the Moslems. Though he was a leading student of the Ramban and the generation succeeding him, he he also devoted significant time and energy to the study of Rambam's Moreh Nevuchim and other philosophical works. He served as rabbi of Sarragossa, where he establish a Beit Din and yeshiva.		https://en.wikipedia.org/wiki/Yom_Tov_Asevilli	https://he.wikipedia.org/wiki/%D7%A8%D7%99%D7%98%D7%91%22%D7%90	http://www.jewishencyclopedia.com/articles/15119-yom-tob-ben-abraham-ishbili					Rashba, Ra'ah					M	
Tosafot	Da'at Zikenim	תוספות	דעת זקנים					Rishonim	The Tosafists (12th - 13th centuries) are primarily noted for the commentary on the Talmud. Da'at Zekeinim is a Torah commentary that generally provides "peshat" or "straighforward" interpretations of the text. 	בעלי התוספות (המאות ה-12 וה-13) ידועים בעיקר בזכות פירושם לתלמוד. דעת זקנים הוא פירוש לתורה שבדרך כלל מספק פירושי "פשט" לכתוב.	https://en.wikipedia.org/wiki/Tosafot	https://he.wikipedia.org/wiki/%D7%AA%D7%95%D7%A1%D7%A4%D7%95%D7%AA	http://www.jewishencyclopedia.com/articles/14457-tosafot#anchor43										M	
Ra'avad	Raavad, Avraham ben David of Posquières	ראב"ד	אברהם בן דוד מפּוֹשְקְיֶרָה	1125		1198		Rishonim	Rabbi Avraham ben David of Posquieres (Ra'avad) was a Provencal rabbi, talmudist, and mystic. His best-know work are his extensive critical comments on Rambam Mishneh Torah which are published alongside the Rambam's text in almost every version. He also engaged in written disputes via commentary with his younger contemporary, R. Zerachia Halevi, in defence of the Rif's Halachot. He wrote talmudic commentaries which are quoted extensively by a number of Rishonim. It was from his circle whence the Kabbalah emerged in the 12th century, and the early prominent kabbalists cite his activity as central to that emergence.		https://en.wikipedia.org/wiki/Abraham_ben_David	https://he.wikipedia.org/wiki/%D7%A8%D7%90%D7%91%22%D7%93	http://www.jewishencyclopedia.com/articles/420-abraham-ben-david-of-posquieres					Moses ben Joseph, Meshullam of Lunel					M	
Rif	Isaac Alfasi	רי"ף	יצחק אלפסי	1013	Al Qal'a, Algeria	1103	Lucena, Spain	Rishonim	Rabbi Yitzchak Alfasi, better known as the Rif, was a North African rabbI, talmudist, and halachic decisor. His best-know work was Hilchot HaRif, a digest of Talmudic discussions, followed by the Rif's decisions, which became widely authoritative and formed one of the pillars of the Shulchan Aruch. He is sometimes considered the last of the Gaonim, due to the great authority and reverence he enjoyed. His teacher was Rabbenu Chananel and among his students were R. Yehudah Halevi and R. Yosef (the Ri) Migash.		https://en.wikipedia.org/wiki/Isaac_Alfasi	https://he.wikipedia.org/wiki/%D7%A8%D7%99%22%D7%A3	http://www.jewishencyclopedia.com/articles/12754-rif					Nissim Gaon, Rabeinu Chananel					M	
Natan ben Yehiel	HaAruch, Nathan of Rome	רבי נתן בן יחיאל	הערוך	 c. 1035	Rome, Italy	1110		Rishonim	Rabbi Natan ben Yechiel of Rome was an Italian rabbi and lexicographer. His central work, the Aruch, was the first Talmudic dictionary, and achieved a wide circulation soon after publication. He worked as a peddler of linen, until the opportunity came to devote himself entirely to Torah study. He travelled abroad to study with luminaries in Sicily and Narbonne, eventually returning to serve as head of the yeshiva in Rome.		https://en.wikipedia.org/wiki/Nathan_ben_Jehiel	https://he.wikipedia.org/wiki/%D7%A0%D7%AA%D7%9F_%D7%9E%D7%A8%D7%95%D7%9E%D7%99	http://www.jewishencyclopedia.com/articles/11359-nathan-ben-jehiel					Mazliach ibn al-Basaq, Moses ha-Darshan, Moses Kalfo		Solomon ben Isaac			M	
Maharsha	Shmuel Eidels 	מהרש"א	שמואל אליעזר הלוי איידלס	1555	Kraków, Poland	1631		Achronim	Rabbi Shmuel Eidels (Maharsha) was a Polish rabbi and talmudist whose novellae on both halachic and aggadic passages are found in almost every edition of the Talmud. He was a child prodigy and initially rejected many marriage offers to devote himself entirel to Torah study. After marrying, he moved to Pozen and established a yeshiva, which was supported for twenty years by his mother-in-law, Eidel. In gratitute of her unstinting support, he adopted her name as his surname. He was an active participant in the Council of Four Lands.		https://en.wikipedia.org/wiki/Maharsha	https://he.wikipedia.org/wiki/שמואל_אליעזר_הלוי_איידלס										Maharal	M	Son In law Moses ben Isaac Bonems
