																								
Maharshal	Solomon Luria, Rashal	מהרש"ל	שלמה לוריא	1510	Poznań	1573	Lublin	Achronim	Rabbi Shlomo Luria (Maharshal) was a Polish rabbi, halakhic decisor and talmudist. His prominent family claimed descent from Rashi. He served as rosh yeshiva of the famed yeshiva in Lublin, Poland. He maintained a spirited correspondence with the Rama, to whom he was related. They disagreed pointedly on the importance of philosophy and grammar. He is known for his independence in Torah matters and his strident criticism of the approach of his contemporary scholars to Talmudic commentary. Though his great halachic work, Yam shel Shlomo was overshadowed by the contemporary Shulchan Aruch, it remains a mainstay of Talmudic learning to this day.		https://en.wikipedia.org/wiki/Solomon_Luria	https://he.wikipedia.org/wiki/%D7%A9%D7%9C%D7%9E%D7%94_%D7%9C%D7%95%D7%A8%D7%99%D7%90					Kalonymus Haberkasten	Shalom Shachna, Kalonymus Haberkasten					M	
Abraham Saba	Ẓeror ha-Mor	אברהם סבה	צרור המור	1440	Castille	1508	At Sea	Achronim	Rabbi Avraham Saba was a Spanish teacher and exegete who spent much of his life fleeing persecution. Tseror HaMor is a commentary on the Torah which incorporates mystical explanations from the Zohar.	רבי אברהם סבע (נפטר 1508) היה מורה ופרשן ספרדי שנאלץ רוב חייו לברוח מרדיפות. "צרור המור" הוא פירוש על התורה שמשלב בתוכו הסברים מיסטיים מהזוהר.	https://en.wikipedia.org/wiki/Abraham_Saba	https://he.wikipedia.org/wiki/%D7%90%D7%91%D7%A8%D7%94%D7%9D_%D7%A1%D7%91%D7%A2	http://www.jewishencyclopedia.com/articles/559-abraham-saba					Isaac de Leon					M	
Jonathan Eybeschutz	Yaarot Dvash, Jonathan Eybeschütz	יהונתן אייבשיץ	יערת דבש	1690	Kracow	1764	Altona	Achronim	Yonatan Eybeschutz was a German rabbi, talmudist, halachic decisor, kabbalist and homilist, writing prolifically in all these fields. He was a child prodigy and his personaliity created a great impression upon peope from early on. He spend many years as a rosh yeshiva and dayyan in Prague, but he was never appointed as chief rabbi of city due to suspicions that he was secretly a Sabbatean. While he strenuously denied the allegations, the suspicions continued, espoused especially by Rabbi Yaakov Emden, who deciphered cryptic names in amulets prepared by Rabbi Yonatan as definitively Sabbatean in nature, and found connections between his writings and those of an acquaintance. A contemporary rabbincal tribunal exonerated him of the allegations, and his works are widely studied to this day. He was a preacher of great force and eloquence and his collected homilies are amongst the most famous. 		https://en.wikipedia.org/wiki/Jonathan_Eybeschutz	https://he.wikipedia.org/wiki/יהונתן_אייבשיץ	http://www.jewishencyclopedia.com/articles/5471-eibenschutz-jonathan				Isaac Spira				Yaakov Emden		M	
Yaakov Tzvi Mecklenburg	HaKetav VeHakabbalah	יעקב צבי מקלנבורג	הכתב והקבלה	1785	Leszno, Poland	1865	Kalingrad	Achronim	Rabbi Mecklenberg was a German rabbi and Torah scholar. HaKetav VeHakabbalah is a Torah commentary designed to demonstrate the close connections between Rabbinic law and the Biblical text.	הרב יעקב צבי מקלנבורג (נפטר 1865) היה רב ותלמיד חכם גרמני. "הכתב והקבלה" הוא פירוש לתורה שמטרתו להראות את הקשר הקרוב בין הלכה לטקסט התנ"כי.	https://en.wikipedia.org/wiki/Yaakov_Tzvi_Mecklenburg	https://he.wikipedia.org/wiki/%D7%99%D7%A2%D7%A7%D7%91_%D7%A6%D7%91%D7%99_%D7%9E%D7%A7%D7%9C%D7%A0%D7%91%D7%95%D7%A8%D7%92						Zechariah Mendel					M	
Riva	Isaac ben Asher Halevi	ריב"א	רבי יצחק בן אשר הלוי					Rishonim	Rabbi Yitschak ben Asher Halevi was an early Tosafist who lived in Speyer and was a student of Rashi, the great Talmud and Torah commentator. Riv"a's Torah commentary is preserved in texts from other Tosafists (Talmud commentators) of his time.	הרב יצחק בן אשר הלוי (המאה ה-11) היה בעל תוספות מוקדם שחי בשפייר והיה תלמיד של רש"י, פרשן התורה והתלמוד הידוע. פירוש הריב"א לתורה נשמר בכתבים מבעלי תוספות אחרעם בדורו.	https://en.wikipedia.org/wiki/Isaac_ben_Asher_ha-Levi	https://he.wikipedia.org/wiki/%D7%99%D7%A6%D7%97%D7%A7_%D7%91%D7%9F_%D7%90%D7%A9%D7%A8_%D7%94%D7%9C%D7%95%D7%99					Eliakim ben Meshullam		Tosafot				M	
Hayyim Joseph David Azulay	Penei David, Hida, Chida	חיים דוד אזולאי	פני דוד	1724	Jerusalem	1806	Livorno, Italy	Achronim	Rabbi Hayyim Yosef David Azulai was a scholar and a prolific writer and publisher. He was born in Jerusalem, and spent much of his life traveling throughout the Jewish communities of Europe.	הרב חיים יוסף דוד אזולאי (נפטר 1806) היה תלמיד חכם, סופר ומוציא לאור. הוא נולד בירושלים ובילה את רוב חייו בנסיעות לקהילות שונות באירופה.	https://en.wikipedia.org/wiki/Chaim_Joseph_David_Azulai	https://he.wikipedia.org/wiki/%D7%97%D7%99%D7%99%D7%9D_%D7%99%D7%95%D7%A1%D7%A3_%D7%93%D7%95%D7%93_%D7%90%D7%96%D7%95%D7%9C%D7%90%D7%99	http://www.jewishencyclopedia.com/articles/2232-azulai-azulay										M	
Brisker Rav	R. Velvel Soloveitchik, Yizhak Zev Halevi Soloveitchik	גרי"ז	יצחק זאב הלוי סולובייצ'יק	1886	Valozhyn	1959	Jerusalem	Achronim	Rabbi Yitschak Zev HaLevi Soloveitchik, also known as the "Brisker Rav," was the head of the Brisk Yeshiva in Jerusalem. The Gri"z (which stands for Gaon Rabbi Yitschak Zev) is famous for his conceptual approach to all texts, including in his Torah commentary.	הרב יצחק זאב הלוי סולובייצ'יק (נפטר 1959), הידוע גם בכינויו "הרב מבריסק", היה ראש ישיבת בריסק בירושלים. הגרי"ז (ראשי תיבות של הגאון רבי יצחק זאב) ידוע בזכות גישתו הקונספטואלית לכל הטקסטים, כולל פירושו לתורה.	https://en.wikipedia.org/wiki/Yitzchok_Zev_Soloveitchik	https://he.wikipedia.org/wiki/%D7%99%D7%A6%D7%97%D7%A7_%D7%96%D7%90%D7%91_%D7%94%D7%9C%D7%95%D7%99_%D7%A1%D7%95%D7%9C%D7%95%D7%91%D7%99%D7%99%D7%A6%27%D7%99%D7%A7			Chaim Soloveitchik 								M	
Joseph ben Meir Teomim	Pri Megadim, Teivat Gome 	יעקב בן מאיר תאמים	תיבת גומא	1727	Lviv	1792	Frankfurt an der Oder	Achronim	Rabbi Yosef ben Meir Teomim was a Galician halakhist and teacher. He is best known for his legal commentaries on the Shulkhan Arukh, the great sixteenth-century law code.	הרב יוסף בן מאיר תאומים (נפטר 1792) חי בגליציה והיה איש הלכה ומורה. הוא ידוע בזכות הפירושים ההלכתיים שלו על השולחן ערוך, ספר ההלכה החשוב מהמאה ה-16. 	https://en.wikipedia.org/wiki/Joseph_ben_Meir_Teomim	https://he.wikipedia.org/wiki/%D7%99%D7%95%D7%A1%D7%A3_%D7%AA%D7%90%D7%95%D7%9E%D7%99%D7%9D	http://www.jewishencyclopedia.com/articles/14324-te-omim-joseph-ben-meir										M	
Isaac ben Joseph Caro	Toledot Yitschak	יצחק בן יוסף קארו	תולדות יצחק	1458	Toledo, Spain	1535	Jerusalem	Achronim	Rabbi Yitschak Karo was a Spanish teacher, halakhic decisor, and physician. Toldot Yitschak is a commentary on the five books of the Torah 	רבי יצחק קארו (נפטר 1535) חי בספרד והיה מורה, פוסק הלכה ורופא. "תולדות יצחק" הוא פירוש על חמישה חומשי תורה.	https://en.wikipedia.org/wiki/Isaac_Karo	https://he.wikipedia.org/wiki/%D7%99%D7%A6%D7%97%D7%A7_%D7%A7%D7%90%D7%A8%D7%95											M	Nephew Joseph ben Ephraim Caro
Abudarham	David ben Josef ben David Abudarham	אבודרהם	דוד בן יוסף בן דוד אבודרהם	c. 1340				Rishonim	Rabbi David ben Yosef Abudraham (mid. 14th century) was a Spanish rabbi and commentator on Jewish liturgy. His best-work is Sefer Abudraham, one of the earliest and most widely accepted commentary and explanatiion on Jewish liturgy. He was closely connect to the Rosh and his son, R. Yaakov Ba'al HaTurim.		https://en.wikipedia.org/wiki/David_Abudirham	https://he.wikipedia.org/wiki/%D7%93%D7%95%D7%93_%D7%90%D7%91%D7%95%D7%93%D7%A8%D7%94%D7%9D	http://www.jewishencyclopedia.com/articles/690-abudarham-david-ben-joseph-ben-david							Jacob ben Asher			M	
Benno Jacob		בנו יעקב		1862	Wrocław	1945	London	Achronim	Rabbi Benno Jacob was a Reform German rabbi who also had an academic degree in Semitics. Rabbi Benno Jacob's Torah commentary explains each verse in depth in order to show the internal logic of the Torah and to disprove the Documentary Hypothesis. 	הרב בנו יעקב (נפטר 1945) היה רב גרמני רפורמי בעל תואר אקדמי בשפות השמיות. פירושו לתורה מסביר כל פסוק לעומק כדי להראות את ההיגיון הפנימי של התורה ולסתור את תורת התעודות.	https://en.wikipedia.org/wiki/Benno_Jacob	https://he.wikipedia.org/wiki/%D7%91%D7%A0%D7%95_%D7%99%D7%A2%D7%A7%D7%91	http://www.jewishencyclopedia.com/articles/8394-jacob-benno										M	
Chaim Paltiel	Ḥayyim Paltiel	רב חיים פלטיאל						Rishonim	Rabbi Chayyim Paltiel was a 13th century French Torah commentator.	רבי חיים פלטיאל היה פרשן תורה צרפתי מהמאה ה-13.	https://en.wikipedia.org/wiki/Chaim_Paltiel_(Paltiel_of_Falaise)		http://www.jewishencyclopedia.com/articles/7370-hayyim-of-falaise-hayyim-paltiel			Samuel of Falaise			Tosafot				M	
Ovadiah Bartenura	Ovadiah of Bertinoro	רב עובדיה מברטנורא		1445	Bertinoro	1515	Jerusalem	Achronim	Rabbi Ovadiah MiBartenura was an Italian scholar who was most famous for his Mishnah commentary. Rabbi Ovadiah MiBartenura's Torah commentary elucidates Rashi's comments on the Torah. 	רבי עובדיה מברטנורא (נפטר בסביבות 1515) היה תלמיד חכם איטלקי שידוע בעיקר בזכות פירושו למשנה. פירושו של רבי עובדיה מברטנורא מבהיר את פירושו של רש"י על התורה. 	https://en.wikipedia.org/wiki/Obadiah_ben_Abraham_Bartenura	https://he.wikipedia.org/wiki/%D7%A2%D7%95%D7%91%D7%93%D7%99%D7%94_%D7%9E%D7%91%D7%A8%D7%98%D7%A0%D7%95%D7%A8%D7%90	http://www.jewishencyclopedia.com/articles/3171-bertinoro-obadiah-yareh-b-abraham					Joseph Colon Trabotto					M	
Eliyahu ben Abraham Mizrahi	Re'em	אליהו בן אברהם מזרחי	רא"ם	c. 1445	Istanbul	1525/1526		Achronim	Rabbi Eliyahu Mizrachi was a talmudist and halakhic decisor who served as Chief Rabbi of the Ottoman Empire. Sefer HaMizrachi is a supercommentary on Rashi's Torah commentary, which explains Rashi's sources and elucidates his comments.	הרב אליהו מזרחי (נפטר בסביבות 1525) היה בעל גמרא ופוסק הלכה שכיהן כרב הראשי של האימפריה העות'מנית. ספר המזרחי הוא פירוש על פירושו של רש"י לתורה. הוא מסביר את המקורות של רש"י ומבהיר את הפירושים שלו.	https://en.wikipedia.org/wiki/Elijah_Mizrachi	https://he.wikipedia.org/wiki/%D7%90%D7%9C%D7%99%D7%94%D7%95_%D7%9E%D7%96%D7%A8%D7%97%D7%99	http://www.jewishencyclopedia.com/articles/10894-mizrahi					Elijah ha-Levi,Judah Minz					M	
Maharal	Judah Loew ben Bezalel	מהר"ל	רבי יהודה ליווא בן בצלאל	1520	Poznań	1609	Prague	Achronim	Rabbi Yehuda Loew ben Bezalel, the Maharal of Prague, was a Bohemian rabbi, talmudist, mystically inclined philosopher and community leader whose personality wriitings left an indelible impression on both his immediate and subsequent generations of Ashekenazic Jewry.  His numerous philosophical works became cornerstones of Jewish thought, and had a profound influence on Chassidic teaching and some of the most prominent thinkers of modern Orthodoxy, including Rav Kook.  He also wrote halachic works, including a commentary on the Arba'ah Turim.  He had a close relationship with the famous astronomer Tycho Brahe. Amongst his students were R. Yom Tov Lipmann Heller (Tosafot Yom Tov) and the historian R David Ganz (Tzemach David). He is famously associated with the Golem of Prague in popular literature from centuries later.		https://en.wikipedia.org/wiki/Judah_Loew_ben_Bezalel	https://he.wikipedia.org/wiki/%D7%9E%D7%94%D7%A8%22%D7%9C_%D7%9E%D7%A4%D7%A8%D7%90%D7%92	http://www.jewishencyclopedia.com/articles/10029-lisser-joshua-falk		Rabbi Bezalel Loew								M	Uncle Jakob ben Hayyim
David Altschuler		רבי דוד אלטשולר		1687		1769	Jaworów, Poland	Achronim	Rabbi David Altshul was an 18th century Torah commentator. Metsudat David is a commentary on Prophets and Writings that is designed to help the reader understand the meaning of the text. Metsudat Tsion is essentially a dictionary for difficult words in the Bible; the words are listed and translated.	הרב דוד אלטשול היה פרשן תורה שחי במאה ה-18. "מצודת דוד" הוא פירוש על הנביאים והכתובים שמטרתו לעזור ללומד להבין את משמעות הכתוב. "מצודת ציון" הוא למעשה מילון למילים קשות בתנ"ך; המילים רשומות ומתורגמות.		https://he.wikipedia.org/wiki/%D7%93%D7%95%D7%93_%D7%90%D7%9C%D7%98%D7%A9%D7%95%D7%9C%D7%A8	http://www.jewishencyclopedia.com/articles/1335-altschul-altschuler-altschueler		Aryeh Leb Altschuler								M	
Jedidiah Solomon ben Abraham Norzi		רבי ידידיה שלמה רפאל נוֹרְצִי		1560	Mantua	1626	Mantua	Achronim	Rabbi Yedidiah Solomon ben Abraham Nortsi was an Italian rabbi and Biblical scholar. Minchat Shai is a critical commentary of the Bible which presents all of the variant readings from within Rabbinic literature. 	הרב ידידיה שלמה בן אברהם נורצי (נפטר 1626) היה רב איטלקי וחוקר מקרא. מנחת שי הוא פרשנות ביקורתית על התנ"ך המציגה את כל קריאות הגרסה מתוך ספרות חז"ל.	https://en.wikipedia.org/wiki/Jedidiah_Norzi	https://he.wikipedia.org/wiki/%D7%99%D7%93%D7%99%D7%93%D7%99%D7%94_%D7%A9%D7%9C%D7%9E%D7%94_%D7%A8%D7%A4%D7%90%D7%9C_%D7%A0%D7%95%D7%A8%D7%A6%D7%99											M	
Onkelos	Onqelos	אונקלוס						Tannaim	Onkelos, according to tradition, was a Roman convert to Judaism who lived in the first or second century.  He translated Tanach into Aramaic, the spoken language of the day. Some identify Onkelos with a convert named Aquilas who translated the Tanach into Greek. According to tradition he was counselled by his uncle, the emperor, to succeed by buying low and selling high. He later explained his conversion to his incensed uncle by repeating to him his own advice of years earlier. Onkelos' translation became the standard Aramaic translation, used daily by Jews world-wide long after Aramaic ceased being a living language for most Jews.		https://en.wikipedia.org/wiki/Onkelos	https://he.wikipedia.org/wiki/%D7%90%D7%95%D7%A0%D7%A7%D7%9C%D7%95%D7%A1	http://www.jewishencyclopedia.com/articles/11712-onkelos										M	
Yoel ben Shnuel Sirkes	Joel ben Samuel Sirkis, Bach	יואל בן שמואל סירקיש	ב"ח	1561	Lublin	1640	Kraków	Achronim	Rabbi Yoel Sirkes (d. 1640) was a Polish rabbi, halakhic scholar and talmudic annotator. His best-know work, Bait Chadash, is one of the basic commentaries (together with R Yosef Karo's Beit Yosef) on R. Yaakov ben Asher's halachic code, the Arba'ah Turim. Hagahot Habach are his indispensible glosses on the text of the Talmud. The Taz was his son-in-law.		https://en.wikipedia.org/wiki/Joel_Sirkis	https://he.wikipedia.org/wiki/%D7%99%D7%95%D7%90%D7%9C_%D7%A1%D7%99%D7%A8%D7%A7%D7%99%D7%A9	http://www.jewishencyclopedia.com/articles/8456-jacob-b-samuel-sirkes										M	
Shabbatai ben Meir Hakohen	Siftei Cohen, Shakh	שבתי בן מאיר הכהן	ש"ך	1621	Amstibovo or Vilna	1662	Holleschau	Achronim	Rabbi Shabbatai Hakohen was a Lithuanian/Polish rabbi, halakhic scholar and talmudist. His best-know work, Siftei Kohen, is one of the basic commentaries on the Shulchan Aruch (on the sections Yoreh Deah and Choshen Mishpat). His rulings were widely accepted by Ashkenazic Jewry as authoritative. He wrote critical commentaries on the Turei Zahav, the other great commentary on the Shulchan Aruch.		https://en.wikipedia.org/wiki/Shabbatai_HaKohen	https://he.wikipedia.org/wiki/%D7%A9%D7%91%D7%AA%D7%99_%D7%9B%D7%94%D7%9F	http://www.jewishencyclopedia.com/articles/13474-shabbethai-b-meir-ha-kohen-shak										M	
David HaLevi Segal	Turei Zahav, Taz	דוד הלוי סגל	ט"ז	c. 1586	Ludmir, Volhynia	1667	Lemberg	Achronim	Rabbi David Halevi Segal was a Polish rabbi, halakhic scholar and talmudist. His best-known work, Turei Zahav, is one of the basic commentaries on the Shulchan Aruch (on all four sections, most prominently on Yoreh Deah and Orach Chayyim). He responded to the Shach's critiques of his expositions and decisions in a separate work. and also authored Divrei David, a supercommentary on Rashi's Torah commentary. The Bach was his father-in-law		https://en.wikipedia.org/wiki/David_HaLevi_Segal	https://he.wikipedia.org/wiki/דוד_הלוי_סגל	http://www.jewishencyclopedia.com/articles/4979-david-b-samuel-ha-levi		Samuel ha-Levi Segal		Bach						M	
Yaakov Emden	Ya'avetz	יעקב עמדין	יעב"ץ	1697	Altona	1776	Altona	Achronim	Rabbi Yaakov Emden was a German rabbi, talmudist and polemecist. He is most well-known for his publically promoted and literarily defended identification of Rabbi Yonatan Eibeschutz as a hidden Sabbatean. He published many works, amongst which is a highly regarded and republished siddur with extensive commentary, and a collection of responsa, She'ilat Ya'avetz. His father was the Chacham Tzvi. 		https://en.wikipedia.org/wiki/Jacob_Emden	https://he.wikipedia.org/wiki/יעקב_עמדין	http://www.jewishencyclopedia.com/articles/5730-emden-jacob-israel-ben-zebi-ashkenazi				Tzvi Hirsch ben Yaakov Ashkenazi				Jonathan Eybeschutz		M	
Yom-Tov Lipmann Heller	Tosafot Yom Tov	יום-טוב ליפמן הלר	תוספות יום טוב	c. 1579	Wallerstein, Bavaria	1654	Krakow	Achronim	Rabbi Yom-Tov Lipmann Heller, was a Bohemian rabbi and talmudist. His best-known work, Tosafot Yom Tov, is one of the basic commentaries on the Mishnah. He also wrote Ma'adanei Yom Tov, an important commentary on Piskei HaRosh of Rabbi Asher ben Yechiel. He studied under the Maharal of Prague, and served as rabbi of Vienna and Prague. Many prominent rabbis of subsequent generations are his descendants.		https://en.wikipedia.org/wiki/Yom-Tov_Lipmann_Heller	https://he.wikipedia.org/wiki/יום-טוב_ליפמן_הלר	http://www.jewishencyclopedia.com/articles/7542-heller-yom-tob-lipmann-ben-nathan-ben-moses-levi			Moses Ha-Levi Heller		Maharal					M	
Martin Buber		מרטין בובר		1878	Vienna	1965	Jerusalem	Contemporary	Martin Buber was a Jewish scholar and philosopher best known for his existentialist work I and Thou (Ich und Du) He was born in an Orthodox home in Vienna and raised in Lvov, but later returned to Vienna to study modern philosphy. He was a scholar, translator and explicator of Hasidic lore, which he compiled in Tales of the Hasidim. He was an ardent Zionist, settling in Jerusalem in 1938, where he became a professor at the Hebrew University.		https://en.wikipedia.org/wiki/Martin_Buber	https://he.wikipedia.org/wiki/%D7%9E%D7%A8%D7%98%D7%99%D7%9F_%D7%91%D7%95%D7%91%D7%A8				Solomon Buber		Solomon Buber					M	descedent of Maharam
Solomon Buber		שלמה בובר		1826	Lemberg, Galicia	1906	Lemberg, Galicia	Achronim	Solomon (or Salomon) Buber was a scholar and editor of Hebrew works, particularly known for his original research and prolific explication of Midrashic literature. He wrote elaborate and exhaustive commentaries of Midrashic works including Pesikhta de-Rab Kahana, Midrash Abkir, Midrash Tanchuma, Midrash Tehillim, Midrash Shmuel and Midrash Mishle. He was also the primary teacher of his grandson, Martin Buber, who lived with him from the age of three.		https://en.wikipedia.org/wiki/Salomon_Buber	https://he.wikipedia.org/wiki/שלמה_בובר											M	
Eliyahu David Rabinowitz Teomim	Aderet	אליהו דוד רבינוביץ' תאומים	אדר"ת	1843	Pikeliai, Russia	1905	Jerusalem	Achronim	Rabbi Eliyahu David Rabinowitz Teomim (d. 1905. known by his acronym, Aderet), was a Lithuanian rabbi and talmudist who served, toward the end of his life, as leader of the Ashkenazic community in Jerusalem.  He wrote many works, filled with original insights, in all areas of Torah. Rabbi Avraham Yitzchak Hakohen Kook was his son-in-law.		https://en.wikipedia.org/wiki/Eliyahu_David_Rabinowitz-Teomim	https://he.wikipedia.org/wiki/%D7%90%D7%9C%D7%99%D7%94%D7%95_%D7%93%D7%95%D7%93_%D7%A8%D7%91%D7%99%D7%A0%D7%95%D7%91%D7%99%D7%A5%27_%D7%AA%D7%90%D7%95%D7%9E%D7%99%D7%9D	http://www.jewishencyclopedia.com/articles/12514-rabinowitz-elijah-david-ben-benjamin		Benjamin Rabinowitz								M	
Johanan Treves		יוחנן בן מתתיהו				1439		Rishonim	Rabbi Yochanan Treves (d. 1439) was a French rabbi and talmudist. As chielf rabbi of France, he was involved in a bitter dispute with R. Yitzchak ben Abba Mari regarding the right to ordain French rabbis. Upon the expulsion of Jews from France in he settled in Italy.  Many of his rulings are quoted in the authoritative halachic compendium, Sha'arei Dura.				http://www.jewishencyclopedia.com/articles/14503-treves								Meir ben Baruch of Vienna		M	
Eliyahu Ben Harun		אליהו בן הרון						Achronim	Rabbi Eliyahu Ben Harush was a Moroccan rabbi. He was known for his great humility and constant devotion to Torah study. His sermons and poetry were also highly admired. He wrote a commentary on the Chumash and the Haggadah.														M	
Tevele Bondi		טבילי בונדי						Achronim															M	
Yaakov Lorberbaum	Yaakov ben Yaakov Moshe Lorberbaum of Lissa, Ba'al HaChavat Da'at, Ba'al HaNesivot, the Rav of Lissa	יעקב בן יעקב משה מליסא	הרב מליסה	1760		1832	Stryj	Achronim	Rabbi Yaakov Lorberbaum (d. 1832), was a Polish rabbi, talmudist and halachic decisor. His best-known works, Chavot Da'at, on Shulchan Aruch Yoreh De'ah and Netivot Mishpat, on Shulchan Aruch Choshen Mishpat have had a formative impact on classic Torah study to the present day. He was a great-grandson of the Chacham Tzvi. 		https://en.wikipedia.org/wiki/Yaakov_Lorberbaum	https://he.wikipedia.org/wiki/%D7%99%D7%A2%D7%A7%D7%91_%D7%9C%D7%95%D7%A8%D7%91%D7%A8%D7%91%D7%95%D7%99%D7%9D				Tzvi Hirsch ben Yaakov Ashkenazi		Meshulam Igra					M	Relative of Jacob Emden and Joseph Teomim
Yedidiah Tiah Weil		ידידיה טיאה ווייל		1721	Prague	1805	Karlsruhe	Achronim	Rabbi Yedidiah Tiah Weil was a German rabbi. He received his early instruction from his father. the Korban Netan'el.. In 1744 he married Gitel, daughter of Jacob Eger, a well-to-do resident of Prague; but the expulsion of the Jews from Prague led him to Metz in 1745, where he remained until 1748, continuing his studies under Jonathan Eybeschütz.  In 1770 he succeeded his father as rabbi of Carlsruhe. . His will shows him to have been a man of great piety and knowlegeable in Kabbalah.														M	
Naftali ben Shimon Hertz Ginzburg		נפתלי בן שמעון הריץ						Achronim	Rabbi Naftali Hertz Ginzburg was a Polish rabbi who came from an illustrious family that produced nine generations of Rabbis and was widely respected for his Torah knowledge.  He had daughters, but, to his dismay, no sons.														M	
Yirachmiel Yisrael Danziger	Yismach Yisrael, Yerachmiel Israel Yitzchak Dancyger	ירחמיאל ישראל יצחק דנציגר		1853	Aleksandrów Łódzki,	1910	Aleksandrów Łódzki,	Achronim	Rabbi Yirachmiel Yisrael Danziger (d. 1910) was the second Rebbe of the Alexander Chassidic dynasty in Poland. His work, Yismach Yisrael, focuses on practical piety and is widely learned in other Chassidic circles as well. He emphasized ecstatic prayer in worship. 		https://en.wikipedia.org/wiki/Aleksander_(Hasidic_dynasty)	https://he.wikipedia.org/wiki/%D7%97%D7%A1%D7%99%D7%93%D7%95%D7%AA_%D7%90%D7%9C%D7%9B%D7%A1%D7%A0%D7%93%D7%A8			Yechiel Dancyger								M	
Avraham Yitchak HaCohen Kook	Rav Kook	הרב אברהם יצחק הכהן קוק		1865	Grīva	1935	Jerusalem	Achronim	Rabbi Avraham Yitzchak Hakohen Kook (d. 1935) was a towering Torah personality and tremendously influential leader in Lithuania and the Land of Israel. A master of almost every facet of Jewish literature, he wrote halachic and aggadic works, as well as philosophical and mystical tracts, responsa and commentaries. His voluminous correspondence covers every imaginable topic. He served as chief rabbi of Yaffo and as the first modern chief rabbi of the entire Jewish community of the Land of Israel.		https://en.wikipedia.org/wiki/Abraham_Isaac_Kook	https://he.wikipedia.org/wiki/%D7%90%D7%91%D7%A8%D7%94%D7%9D_%D7%99%D7%A6%D7%97%D7%A7_%D7%94%D7%9B%D7%94%D7%9F_%D7%A7%D7%95%D7%A7	http://www.jewishencyclopedia.com/articles/2676-bausk		Shlomo Zalman Ha-Cohen Kook			i Eliyahu David Rabinowitz-Teomim					M	
